{
  "$schema": "http://json-schema.org/draft-07/schema#",
  "$id": "https://github.com/GFCDOTA/sketchup-mcp/blob/develop/fixtures/planta_74/human_openings_truth.schema.json",
  "title": "Human openings ground truth",
  "description": "Machine-readable mandatory ground truth for openings (doors, windows, glazed balconies). When this file exists, it overrides any detector-emitted opening for the same planta. Extracted from a color-coded PNG annotation by `tools/extract_human_openings.py`.",
  "type": "object",
  "required": ["schema_version", "source_image", "image_size_px", "pdf_page_size_pts", "required_counts", "openings"],
  "properties": {
    "schema_version": {"const": "1.0"},
    "source_image": {"type": "string", "description": "Relative path to the annotated PNG."},
    "image_size_px": {
      "type": "array",
      "items": {"type": "integer"},
      "minItems": 2,
      "maxItems": 2,
      "description": "[width, height] in pixels."
    },
    "pdf_page_size_pts": {
      "type": "array",
      "items": {"type": "number"},
      "minItems": 2,
      "maxItems": 2,
      "description": "[width, height] in PDF points."
    },
    "color_mapping": {
      "type": "object",
      "description": "RGB → opening kind mapping used during extraction.",
      "additionalProperties": {
        "type": "object",
        "required": ["rgb", "kind"],
        "properties": {
          "rgb": {"type": "array", "items": {"type": "integer", "minimum": 0, "maximum": 255}, "minItems": 3, "maxItems": 3},
          "kind": {"enum": ["interior_door", "window", "glazed_balcony"]}
        }
      }
    },
    "required_counts": {
      "type": "object",
      "description": "Total count of openings of each kind. The structural_checks gate FAILS if any actual count falls below the required.",
      "properties": {
        "interior_door": {"type": "integer", "minimum": 0},
        "window": {"type": "integer", "minimum": 0},
        "glazed_balcony": {"type": "integer", "minimum": 0}
      }
    },
    "openings": {
      "type": "array",
      "description": "Extracted opening list. Each entry is the canonical anchor for `consume_consensus.rb` to render.",
      "items": {
        "type": "object",
        "required": ["id", "kind", "color", "bbox_px", "bbox_pts", "center_pts", "orientation"],
        "properties": {
          "id": {"type": "string", "pattern": "^h_o\\d{3}$"},
          "kind": {"enum": ["interior_door", "window", "glazed_balcony"]},
          "color": {"enum": ["green", "magenta", "orange"]},
          "bbox_px": {"type": "array", "items": {"type": "number"}, "minItems": 4, "maxItems": 4},
          "bbox_pts": {"type": "array", "items": {"type": "number"}, "minItems": 4, "maxItems": 4},
          "center_pts": {"type": "array", "items": {"type": "number"}, "minItems": 2, "maxItems": 2},
          "orientation": {"enum": ["h", "v"]},
          "wall_id": {"type": ["string", "null"], "description": "Nearest matching wall id from consensus.walls. May be null if no wall is close enough; the apply step will then create a soft-anchor opening with `wall_id=null` (the Ruby exporter handles these as floating door leaves)."},
          "wall_dist_pts": {"type": ["number", "null"]},
          "opening_width_pts": {"type": "number", "minimum": 0},
          "required": {"const": true}
        }
      }
    },
    "explicit_constraints": {
      "type": "array",
      "description": "Named positional constraints (e.g. 'BANHO 02 must have west door'). Each is enforced as its own gate; failing any causes FAIL.",
      "items": {
        "type": "object",
        "required": ["name", "description", "kind", "policy"],
        "properties": {
          "name": {"type": "string"},
          "description": {"type": "string"},
          "kind": {"enum": ["interior_door", "window", "glazed_balcony"]},
          "policy": {"enum": ["require_present", "require_absent"]},
          "search_region_pts": {
            "type": "array",
            "items": {"type": "number"},
            "minItems": 4,
            "maxItems": 4,
            "description": "[x0, y0, x1, y1] in PDF points. For require_present: at least one opening of `kind` must have its center inside this region. For require_absent: no opening of `kind` may have its center inside this region."
          }
        }
      }
    }
  }
}
